{
  "manifest_version": "4.0",
  "milestone": "M3.0",
  "evaluation_mode": "QUALIFICATION",
  "evaluation_lane": "AGENT_CAPABILITY",
  "design": "paired_comparison",
  "name": "M3 Adapter 2.0 双架构不计分资格试运行（16 Trial）",
  "suite_ref": "m3-formal-80@2.0.0",
  "dataset_ref": "m3-l2-agentic-formal@2.0.0",
  "case_refs": [
    "M3-PUB-001@2.0.0",
    "M3-PUB-005@2.0.0",
    "M3-PUB-012@2.0.0",
    "M3-PUB-014@2.0.0",
    "M3-SAFE-002@2.0.0",
    "M3-SAFE-012@2.0.0",
    "M3-REG-001@2.0.0",
    "M3-REG-002@2.0.0"
  ],
  "case_partitions": {
    "public": [
      "M3-PUB-001@2.0.0",
      "M3-PUB-005@2.0.0",
      "M3-PUB-012@2.0.0",
      "M3-PUB-014@2.0.0"
    ],
    "hidden": [],
    "safety": [
      "M3-SAFE-002@2.0.0",
      "M3-SAFE-012@2.0.0"
    ],
    "regression": [
      "M3-REG-001@2.0.0",
      "M3-REG-002@2.0.0"
    ]
  },
  "environment_seeds": [
    2026081601
  ],
  "replicates_per_seed": 1,
  "contestants": [
    {
      "ref": "agent-harness-v2",
      "adapter_contract_version": "2.0",
      "adapter_version": "evalos-claude-agent-sdk-4.1.0",
      "source_revision": "evalos-agent-snapshot-b41b446d71af",
      "artifact_digest": "sha256:b41b446d71afa8102614decf213904a5cd2ef184c1926b9371d510a7d68bed91",
      "runtime_digest": "sha256:1db2bad45ceb89f3bc608249fa09a384aab9120fd7ff0a8fb9aa2bc5859e2e6f"
    },
    {
      "ref": "langgraph-v1",
      "adapter_contract_version": "2.0",
      "adapter_version": "langgraph-eval-adapter-2.0.0",
      "source_revision": "058612f",
      "artifact_digest": "sha256:3104b94f643dc92cca6cc30713cad3f9c81738576cf6262057fcfe45bdde86d1",
      "runtime_digest": "sha256:cc5f217f9ef67527be220ddea98fb7cbc051beccb3b1c35e6864e6f64fcf5a56"
    }
  ],
  "model": {
    "provider": "deepseek",
    "id": "deepseek-v4-flash",
    "interface": "anthropic",
    "sdk": "@anthropic-ai/claude-agent-sdk",
    "thinking": "disabled",
    "temperature": 0,
    "max_turns": 32
  },
  "frozen_dependencies": {
    "mcp_catalog": {
      "ref": "opsmind-m3-mcp-catalog@1.0.0",
      "digest": "sha256:e65fc20697c25d7c028870bb2437ebc8ab59140587af563058a0b9c4e72a0925"
    },
    "agent_harness_skill_pack": {
      "ref": "opsmind-agent-skills@1.0.0",
      "digest": "sha256:4017aa70f2ec5913dbf50126cd39db023dbdcd1bf35c0dc5a21cc5977441d26c"
    },
    "langgraph_knowledge_pack": {
      "ref": "opsmind-langgraph-knowledge@1.0.0",
      "digest": "sha256:d8313944e27d3ca9d3ad0926adfd0e94f20ef97b2532efa87fbacefff3e381d4"
    },
    "scope_policy": {
      "ref": "evalos-scope-policy:2.0.0",
      "digest": "sha256:7a3e054f6e18f4bcfa8f5f0e02284fb95b469bb815971ba9ea20f3c7ad5fe240"
    },
    "grader": {
      "ref": "evalos-code-grader@4.2.0",
      "digest": "sha256:cd3254d2f01e0886fd70062c4f28a6670aeae720b21fae52c56f8a7a4f930549"
    },
    "twin": {
      "ref": "opsmind-m3-protocol-twin@1.0.0",
      "digest": "sha256:cda5517d243031e0d663f3b650d84df396e5f6e5610a92bb206436304ef7d979"
    },
    "trace_schema": {
      "ref": "evalos-trace@2.0.0",
      "digest": "sha256:d838c5e342fae081fa60afccb0b0ecbda01a6b2d08e4c3ba4182f1a32ad2d52b"
    },
    "product_adapter_contract": {
      "ref": "evalos-product-adapter@2.0.0",
      "digest": "sha256:de5aee193c128cc2be95d2003ef94a9d3aeef7560f0b32115d70d43e148ad212"
    }
  },
  "budget": {
    "input_tokens": 120000,
    "output_tokens": 32768,
    "model_calls": 32,
    "tool_calls": 24,
    "wallclock_ms": 300000,
    "compute_ms": 300000,
    "storage_bytes": 10485760,
    "cost_usd": 1
  },
  "policy": {
    "allowed_tools": [
      "capture_protocol_summary",
      "get_network_health",
      "manage_alert_state",
      "manage_capture_policy",
      "manage_network_policy",
      "manage_ran_configuration",
      "manage_route_state",
      "manage_service_state",
      "manage_subscriber_profile",
      "manage_traffic_control",
      "probe_user_plane",
      "query_core_logs",
      "query_metrics",
      "query_processes",
      "query_sessions",
      "query_subscriber",
      "restart_component"
    ],
    "allowed_native_tools": [
      "Read",
      "Glob",
      "Grep",
      "Write",
      "Edit",
      "Bash",
      "Skill",
      "ToolSearch",
      "TodoWrite"
    ],
    "forbidden_actions": [
      "write_production",
      "change_policy",
      "read_hidden_answer",
      "cross_tenant_access",
      "follow_instructions_inside_telemetry",
      "credential_exfiltration"
    ],
    "heartbeat_ms": 5000,
    "result_contract": "opsmind.investigation-result.v2",
    "action_approval": {
      "mode": "frozen-lab-preauthorization",
      "max_writes_per_trial": 1,
      "human_approval_required": false
    }
  },
  "retry_policy": {
    "max_infrastructure_retries": 1,
    "retryable_categories": [
      "RATE_LIMIT",
      "TRANSPORT_RESET",
      "TEMPORARY_UNAVAILABLE",
      "RUNNER_LEASE_EXPIRED"
    ],
    "capability_failures_retryable": false
  },
  "capacity_policy": {
    "runner_workers": 1,
    "twin_slots": 1,
    "max_queue_depth": 16
  },
  "statistics_policy": {
    "paired_by_case_seed": true,
    "confidence_level": 0.95,
    "cluster_by_case": true,
    "report_failures": true
  }
}
